{
  "$schema": "https://json-schema.org/draft/2020-12/schema",
  "$id": "https://swiftdrop.dev/contracts/events/envelope.schema.json",
  "title": "SwiftDrop event envelope",
  "description": "Shared wrapper for every event published on RabbitMQ. Each event schema narrows eventType and data.",
  "type": "object",
  "required": ["eventId", "eventType", "version", "occurredAt", "producer", "data"],
  "properties": {
    "eventId": {
      "type": "string",
      "format": "uuid",
      "description": "Unique per event. Also sent as the AMQP message_id. Consumers use it to skip duplicates."
    },
    "eventType": {
      "type": "string",
      "pattern": "^[a-z][a-z-]*\\.[a-z][a-z-]*$",
      "description": "<entity>.<past-tense-verb>, the same value as the routing key"
    },
    "version": {
      "type": "integer",
      "minimum": 1,
      "description": "Schema version of data. Raised only for breaking changes."
    },
    "occurredAt": {
      "type": "string",
      "format": "date-time",
      "description": "When the change happened (UTC), not when the message was sent"
    },
    "producer": {
      "type": "string",
      "description": "Name of the publishing service, for example identity-merchant-service"
    },
    "data": {
      "type": "object"
    }
  }
}
